Word	Part of Speech	Origin	Definitionhabitat	noun	Latin	the type of environment in which an organism or group normally lives or occurshabitus	noun	New Latin	person's predisposition to be affected by somethinghaggard	adjective	Middle French	very thin especially from disease or hunger or coldhaggis	noun	Middle English	made of sheep's or calf's viscera minced with oatmeal and suet and onions and boiled in the animal's stomachhalal	adjective	Arabic	conforming to dietary lawshalcyon	adjective	Middle English	idyllically calm and peacefulhalibut	noun	Middle English	marine food fish of the northern Atlantic or northern Pacifichalitosis	noun	New Latin	offensive breathhallux	noun	New Latin	the first largest innermost toehalogen	noun	Swedish	any of five related nonmetallic elements that are all monovalent and readily form negative ionshalogeton	noun	New Latin	a coarse annual herb introduced into North America from Siberiahalophyte	noun	International Scientific Vocabulary	plant growing naturally in very salty soilhamadryad	noun	Latin	large cobra of southeastern Asia and the East Indieshamartia	noun	Greek	the character flaw or error of a tragic hero that leads to his downfallhamate	noun	Latin	the wrist bone in line with the 4th and 5th fingershammock	noun	Spanish	a hanging bed of canvas or rope nettinghammock	noun	Spanish	a hanging bed of canvas or rope nettinghaptic	adjective	International Scientific Vocabulary	of or relating to or proceeding from the sense of touchharangue	noun	Middle French	a loud bombastic declamation expressed with strong emotionharassment	noun	French	the act of tormenting by continued persistent attacks and criticismharicot	noun	French	a French variety of green bean plant bearing light-colored beanshastate	adjective	New Latin	of a leaf shapehauberk	noun	Middle English	a long tunic of chain mail formerly worn as defensive armorhauteur	noun	French	overbearing pride evidenced by a superior manner toward inferiorshavoc	noun	Middle English	violent and needless disturbancehawser	noun	Middle English	large heavy rope for nautical useheathen	adjective	Middle English	not acknowledging the God of Christianity and Judaism and Islamheaume	noun	Middle French	a large medieval helmet supported on the shouldershebdomad	noun	Latin	any period of seven consecutive dayshebetude	noun	Late Latin	mental lethargy or dullnesshecatomb	noun	Latin	a great sacrificehedonism	noun	Greek	an ethical system that evaluates the pursuit of pleasure as the highest goodhegemony	noun	Greek	the dominance or leadership of one social group or nation over othersheifer	noun	Middle English	young cowheinousness	noun	Middle English	the quality of being shockingly cruel and inhumaneheliacal	adjective	Late Latin	pertaining to or near the sunhelichrysum	noun	New Latin	large genus of mostly African and Australian herbs and shrubs: everlasting flowershellebore	noun	Middle English	any plant of the Eurasian genus Helleborushelminthiasis	noun	New Latin	infestation of the body with parasitic wormsHemerocallis	noun	New Latin	east Asian rhizomatous clump-forming perennial herbs having flowers on long leafless stalkshemiplegic	noun	New Latin	a person who has hemiplegiahemorrhage	noun	Latin	flow of blood from a ruptured blood vesselshepatic	adjective	Latin	pertaining to or affecting the liverhereditament	noun	Middle English	any property that can be inheritedhereditary	adjective	Middle English	inherited or inheritable by established rules of descentheresy	noun	Middle English	a belief that rejects the orthodox tenets of a religionhermetically	adverb	Medieval Latin	in an airtight mannerheroine	noun	Latin	the main good female character in a work of fictionherpetology	noun	Greek	the branch of zoology concerned with reptiles and amphibiansherrenvolk	noun	German	a race that considers itself superior to all others and fitted to rule the othersheuristic	adjective	German	of or relating to or using a general formulation that serves to guide investigationhiatus	noun	Latin	a missing piecehibiscus	noun	New Latin	any plant of the genus Hibiscushiemal	adjective	Latin	characteristic of or relating to winterhierarchy	noun	Middle English	the organization of people at different ranks in an administrative bodyhieroglyph	noun	French	a writing system using picture symbolshilum	noun	New Latin	the scar on certain seeds marking its point of attachment to the funiclehippopotamus	noun	Latin	massive thick-skinned herbivorous animal living in or around rivers of tropical Africahircine	adjective	Latin	of or pertaining to or suggestive of a goathoarse	adjective	Middle English	deep and harsh sounding as if from shouting or illness or emotionhobbledehoy	noun	origin unknown	an awkward bad-mannered adolescent boyhollandaise	noun	French	eggs and butter with lemon juiceholocaust	noun	Middle English	an act of great destruction and loss of lifehomage	noun	Middle English	respectful deferencehomeostasis	noun	New Latin	metabolic equilibrium actively maintained by several complex biological mechanisms that operate via the autonomic nervous system to offset disrupting changeshomily	noun	Middle English	a sermon on a moral or religious topichonorarium	noun	Latin	a fee paid for a nominally free servicehorde	noun	Middle French	a vast multitudehorizon	noun	Middle English	the range of interest or activity that can be anticipatedhorticulture	noun	Latin	the cultivation of plantshosanna	noun	Middle English	a cry of praise or adorationhospice	noun	French	a program of medical and emotional care for the terminally illhostage	noun	Middle English	a prisoner who is held by one party to insure that another party will meet specified termshostile	adjective	Middle French or Latin	unsolicited and resisted by the management of the target companyhowitzer	noun	Dutch	a muzzle-loading high-angle gun with a short barrel that fires shells at high elevations for a short rangehuckaback	noun	origin unknown	toweling consisting of coarse absorbent cotton or linen fabricHuguenot	noun	Middle French	a French Calvinist of the 16th or 17th centurieshuisache	noun	Mexican Spanish	tropical American thorny shrub or small treehumectant	noun	Latin	any substance that is added to another substance to keep it moisthumiliation	noun	Late Latin	depriving one of self-esteemhumus	noun	New Latin	partially decomposed organic matterhundredth	adjective	Middle English	the ordinal number of one hundred in counting orderhussar	noun	Hungarian	a member of a European light cavalry unithyacinth	noun	Latin	any of numerous bulbous perennial herbshydraulic	adjective	Latin	of or relating to the study of hydraulicshymnody	noun	Late Latin	the act of singing psalms or hymnshyoid	adjective	New Latin	of or relating to the hyoid bonehypallage	noun	Latin	reversal of the syntactic relation of two wordshyperbole	noun	Latin	extravagant exaggerationhyperglycemia	noun	New Latin	abnormally high blood sugar usually associated with diabeteshypocorism	noun	Late Latin	a name of endearmenthypocrisy	noun	Middle English	insincerity by virtue of pretending to have qualities or beliefs that you do not really havehypokalemia	noun	New Latin	abnormally low level of potassium in the circulating blood leading to weakness and heart abnormalitieshypotenuse	noun	Latin	the side of a right triangle opposite the right anglehypozeuxis	noun	Late Latin	use of a series of parallel clauseshypsometer	noun	International Scientific Vocabulary	an altimeter that uses the boiling point of water to determine land elevationhyssop	noun	Middle English	bitter leaves used sparingly in saladsiatrogenic	adjective	Greek	induced by a physician's words or therapyibidem	adverb	Latin	in the same placeichneumon	noun	Middle English	northern African mongooseichorous	adjective	Greek	of or resembling or characterized by ichor or saniesicosahedron	noun	Greek	any polyhedron having twenty plane facesidiosyncratic	adjective	Greek	peculiar to the individualignominy	noun	Middle French or Latin	a state of dishonorileitis	noun	New Latin	inflammation of the ileumillicitly	adverb	Latin	in an illegal mannerimago	noun	New Latin	an adult insect produced after metamorphosisimaret	noun	Turkish	a hostel for pilgrims in Turkeyimbecilic	adjective	French	having a mental age of three to seven yearsimmaculate	adjective	Middle English	completely neat and cleanimmanent	adjective	Late Latin	of qualities that are spread throughout somethingimmolate	verb	Latin	offer as a sacrifice by killing or by giving up to destructionimmortal	adjective	Middle English	not subject to deathimpasse	noun	French	a street with only one way in or outimpasto	noun	Italian	painting that applies the pigment thickly so that brush or palette knife marks are visibleimpatiently	adverb	Middle English	in an impatient mannerimpedimenta	noun	Latin	the baggage and equipment carried by an armyimpel	verb	Middle English	urge or force to an actionimperceptible	adjective	Middle English	impossible or difficult to perceive by the mind or sensesimperious	adjective	Latin	able to deal authoritatively with affairsimperturbable	adjective	Middle English	not easily perturbed or excited or upsetimpetus	noun	Latin	the act of applying force suddenlyimpingement	noun	Latin	a sharp collision produced by striking or dashing against somethingimprecate	verb	Latin	utter obscenities or profanitiesimpresario	noun	Italian	a sponsor who books and stages public entertainmentsimprimatur	noun	New Latin	formal and explicit approvalimpromptu	adjective	French	with little or no preparation or forethoughtimpugnable	adjective	Middle English	subject to being discreditedimpuissance	noun	Middle English	powerlessness revealed by an inability to actimputrescible	adjective	Late Latin	not subject to decayincarcerate	verb	Latin	"lock up or confine, in or as in a jail"incendiary	adjective	Middle English	capable of catching fire spontaneously or causing fires or burning readilyincessant	adjective	Middle English	occurring so frequently as to seem ceaseless or uninterruptedinchoate	adjective	Latin	only partly in existenceincienso	noun	American Spanish	fragrant rounded shrub of southwestern United States and adjacent Mexico having brittle stems and small crowded blue-green leaves and yellow flowersincinerate	verb	Medieval Latin	become reduced to ashesincipient	adjective	Latin	only partly in existenceincomparable	adjective	Middle English	such that comparison is impossibleincompatible	adjective	Middle English	not compatibleincompetent	adjective	Middle French	not qualified or suited for a purposeincorrigible	adjective	Middle English	impervious to correction by punishmentincrement	noun	Middle English	the amount by which something increasesinculcate	verb	Latin	teach and impress by frequent repetitions or admonitionsindebted	adjective	Middle English	owing gratitude or recognition to another for help or favors etcindefatigable	adjective	Middle French	showing sustained enthusiastic action with unflagging vitalityindigenous	adjective	Late Latin	originating where it is foundindigent	adjective	Middle English	poor enough to need help from othersindignant	adjective	Latin	angered at something unjust or wrongindignity	noun	Latin	an affront to one's dignity or self-esteemindocile	adjective	Middle French	of personsindolent	adjective	Late Latin	slow to heal or develop and usually painlessindubitable	adjective	Middle English	too obvious to be doubtedindulge	verb	Latin	enjoy to excessindulgently	adverb	Latin	in an indulgent mannerindumentum	noun	New Latin	a covering of fine hairs as on a leaf or insectineffable	adjective	Middle English	too sacred to be utteredineluctable	adjective	Latin	"impossible to avoid or evade:""inescapable conclusion"""inerrant	adjective	Latin	not liable to errorinert	adjective	Latin	slow and apatheticinertia	noun	New Latin	the tendency of a body to maintain is state of rest or uniform motion unless acted upon by an external forceinevitability	noun	Middle English	the quality of being unavoidableinexcusably	adverb	Middle English	in an unpardonable manner or to an unpardonable degreeinexorable	adjective	Latin	"impervious to pleas, persuasion, requests, reason"inextirpable	adjective	French or Latin	incapable of extermination or extirpationinfallible	adjective	Middle English	incapable of failure or errorinfarction	noun	Latin	localized necrosis resulting from obstruction of the blood supplyinfatuated	adjective	Latin	marked by foolish or unreasoning fondnessinfinitesimal	adjective	New Latin	infinitely or immeasurably smallinfructescence	noun	French	the fruiting stage of the inflorescenceingenue	noun	French	the role of an innocent artless young woman in a playingurgitate	verb	Latin	overeat or eat immodestlyinimitable	adjective	Middle English	defying imitationinion	noun	New Latin	the craniometric point that is the most prominent point at the back of the headiniquity	noun	Middle English	absence of moral or spiritual valuesinitiate	noun	Late Latin	people who have been introduced to the mysteries of some field or activityinnocuous	adjective	Latin	not injurious to physical or mental healthinnumerable	adjective	Middle English	too numerous to be countedinoculate	verb	Middle English	impregnate with the virus or germ of a disease in order to render immuneinoculum	noun	New Latin	a substance that is introduced into the body to produce or increase immunity to a particular diseaseinordinate	adjective	Middle English	beyond normal limitsinsalubrious	adjective	Latin	detrimental to healthinscrutable	adjective	Middle English	of an obscure natureinsecticide	noun	International Scientific Vocabulary	a chemical used to kill insectsinseparably	adverb	Middle English	without possibility of separationinsidious	adjective	Latin	working or spreading in a hidden and usually injurious wayinsincerity	noun	Latin	the quality of not being open or truthfulinsolation	noun	French or Latin	incident solar radiationinsolent	adjective	Middle English	unrestrained by convention or proprietyinsomniac	adjective	Latin	experiencing or accompanied by sleeplessnessinstantaneous	adjective	Medieval Latin	occurring with no delayinstauration	noun	Latin	the act of starting something for the first timeinsular	adjective	Late Latin	narrowly restricted in outlook or scopeinsulate	verb	Latin	"protect from heat, cold, or noise by surrounding with insulating material"insulin	noun	New Latin	hormone secreted by the isles of Langerhans in the pancreasintaglio	noun	Italian	glyptic art consisting of a sunken or depressed engraving or carving on a stone or gemintegument	noun	Latin	an outer protective covering such as the skin of an animal or a cuticle or seed coat or rind or shellintelligence	noun	Middle English	the operation of gathering information about an enemyintercalary	adjective	Latin	"having a day or month inserted to make the calendar year correspond to the solar year: ""Feb. 29 is an intercalary day"""intercalate	verb	Latin	insert in a calendarinterior	adjective	Middle French and Latin	of or coming from the middle of a region or countryInterlingua	noun	Italian	an artificial language proposed for use as an auxiliary international languageintermezzo	noun	Italian	a short piece of instrumental music composed for performance between acts of a drama or operainterminable	adjective	Middle English	tiresomely longinternecine	adjective	Latin	characterized by bloodshed and carnage for both sidesinterstice	noun	Middle English	small opening between thingsintricate	adjective	Middle English	having many complexly arranged elementsintroit	noun	Middle English	a composition of vocal music that is appropriate for opening church servicesintrouvable	adjective	French	impossible to findintussusception	noun	Latin	growth in the surface area of a cell by the deposit of new particles between existing particles in the cell wallinundation	noun	Latin	the rising of a body of water and its overflowing onto normally dry landinveigh	verb	Latin	speak against in an impassioned mannerinveigle	verb	Anglo-French	"influence or urge by gentle urging, caressing, or flattering"invidious	adjective	Latin	containing or implying a slight or showing prejudiceinvigilate	verb	Latin	watch overinvigilation	noun	Latin	keeping watch over examination candidates to prevent cheatinginviolable	adjective	Middle English	must be kept sacredinvolucre	noun	French	a highly conspicuous bract or bract pair or ring of bracts at the base of an inflorescenceiota	noun	Latin	the 9th letter of the Greek alphabetipecac	noun	Portuguese	a medicinal drug used to evoke vomitingirascible	adjective	Middle French	characterized by angeriridaceous	adjective	New Latin	of or pertaining to or characteristic of plants of the family Iridaceaeirrevocably	adverb	Middle English	in an irrevocable mannerisarithm	noun	International Scientific Vocabulary	a line drawn on a map connecting points having the same numerical value of some variableisochronal	adjective	Greek	equal in duration or intervalisochronous	adjective	Greek	equal in duration or intervalIsraelite	noun	Middle English	a native or inhabitant of the ancient kingdom of Israelizar	noun	Hindi	a voluminous cotton outer garment traditionally worn by Muslim women of northern Africa and the Middle Eastjabot	noun	French	a ruffle on the front of a woman's blouse or a man's shirtjacamar	noun	French	tropical American insectivorous bird having a long sharp bill and iridescent green or bronze plumagejackanapes	noun	Middle English	someone who is unimportant but cheeky and presumptuousJacobin	noun	Middle English	a member of the radical movement that instituted the Reign of Terror during the French Revolutionjadeite	noun	French	a hard green mineral consisting of sodium aluminum silicate in monoclinic crystalline formjaguar	noun	Portuguese	a large spotted feline of tropical America similar to the leopardjalousie	noun	French	a shutter made of angled slatsjambalaya	noun	Louisiana French	"spicy Creole dish of rice and ham, sausage, chicken, or shellfish with tomatoes, peppers, onions, and celery"jambeau	noun	Middle English	armor plate that protects legs below the kneejamboree	noun	origin unknown	a gay festivityjapery	noun	Middle English	acting like a clown or buffoonjargon	noun	Middle English	specialized technical terminology characteristic of a particular subjectjaundice	noun	Middle English	yellowing of the skin and the whites of the eyes caused by an accumulation of bile pigment in the bloodjavelin	noun	Middle English	a spear thrown as a weapon or in competitive field eventsjealous	adjective	Middle English	suspicious or unduly suspicious or fearful of being displaced by a rivaljejune	adjective	Latin	lacking interest or significancejejunely	adverb	Latin	in an immature mannerjerboa	noun	New Latin	mouselike jumping rodentjeremiad	noun	French	a long and mournful complaintjettison	verb	Middle English	throw as from an airplanejocosity	noun	Latin	fun characterized by humorjocundity	noun	Middle English	a feeling facetious merrimentjodhpur	noun	India	a short riding boot that fastens with a buckle at the sidejong	noun	Afrikaans	United States writerjongleur	noun	French	a singer of folk songsjonquil	noun	French	widely cultivated ornamental plant native to southern Europe but naturalized elsewhere having fragrant yellow or white clustered flowersjournal	noun	Middle English	the part of the axle contained by a bearingjuggernaut	noun	Hindi	a crude idol of Krishnajugular	adjective	Late Latin	relating to or located in the region of the neck or throatjulienne	noun	French	a clear soup garnished with julienne vegetablesjunco	noun	New Latin	small North American finch seen chiefly in winterjunket	noun	Middle English	a trip taken by an official at public expensejunta	noun	Spanish	a group of military officers who rule a country after seizing powerjurisdiction	noun	Middle English	in lawjute	noun	Middle English	a member of a Germanic people who conquered England and merged with the Angles and Saxons to become Anglo-Saxonsjute	noun	Middle English	a member of a Germanic people who conquered England and merged with the Angles and Saxons to become Anglo-Saxonskahikatea	noun	Maori	New Zealand evergreen valued for its light easily worked woodkakemono	noun	Japanese	a Japanese wall hangingkaleidoscope	noun	Greek	an optical toy in a tubekama	noun	Sanskrit	god of love and erotic desirekaraoke	noun	Japanese	singing popular songs accompanied by a recording of an orchestrakaryotype	noun	International Scientific Vocabulary	the appearance of the chromosomal makeup of a somatic cell in an individual or specieskatabatic	adjective	Greek	of an air current or windkazoo	noun	origin unknown	a toy wind instrument that has a membrane that makes a sound when you hum into the mouthpiecekazoo	noun	origin unknown	a toy wind instrument that has a membrane that makes a sound when you hum into the mouthpiecekeeshond	noun	Dutch	a spitz-like dog having a shaggy greyish coat and tightly curled tail originating in Hollandkennel	noun	Middle English	outbuilding that serves as a shelter for a dogkennel	noun	Middle English	outbuilding that serves as a shelter for a dogkepi	noun	French	a cap with a flat circular top and a visorkeratitis	noun	New Latin	inflammation of the cornea causing watery painful eyes and blurred visionkestrel	noun	Middle English	small Old World falcon that hovers in the air against a windkhedive	noun	French	one of the Turkish viceroys who ruled Egypt between 1867 and 1914kibbutz	noun	Modern Hebrew	a collective farm or settlement owned by its members in modern Israelkibbutznik	noun	Yiddish	a member of a kibbutzkilderkin	noun	Middle English	an obsolete British unit of capacity equal to 18 Imperial gallonskilowatt	noun	International Scientific Vocabulary	a unit of power equal to 1000 wattskinesiology	noun	Greek	the branch of physiology that studies the mechanics and anatomy in relation to human movementkinetic	adjective	Greek	characterized by motionkinkajou	noun	French	arboreal fruit-eating mammal of tropical America with a long prehensile tailkirsch	noun	German	from fermented juice of black morello cherrieskirtle	noun	Middle English	a long dress worn by womenkishke	noun	Yiddish	beef or fowl casing stuffed and cookedkitsch	adjective	German	of a display that is tawdry or vulgarkiwi	noun	Maori	nocturnal flightless bird of New Zealand having a long neck and stout legskoan	noun	Japanese	a paradoxical anecdote or a riddle that has no solutionkohlrabi	noun	German	fleshy turnip-shaped edible stem of the kohlrabi plantkoine	noun	Greek	a Greek dialect that flourished under the Roman Empirekoinonia	noun	Greek	Christian fellowship or communion with God or with fellow Christianskookaburra	noun	Wiradhuri	Australian kingfisher having a loud cackling crykoto	noun	Japanese	Japanese stringed instrument that resembles a zitherkrill	noun	Norwegian	shrimp-like planktonic crustaceanskrypton	noun	Greek	a colorless element that is one of the six inert gasseskudos	noun	Greek	an expression of approval and commendationkurta	noun	Hindi and Urdu	a loose collarless shirt worn by many people on the Indian subcontinentlabile	adjective	French	open to changelaburnum	noun	New Latin	flowering shrubs or trees having bright yellow flowerslacerate	adjective	Middle English	having edges that are jagged from injurylacertilian	adjective	New Latin	of or relating to lizardslachrymose	adjective	Latin	showing sorrowlacrosse	noun	Canadian French	a goal game in which players use a long-handled stick with a net to catch, carry, and throw the balllacteal	adjective	Latin	relating to or consisting of or producing or resembling milklacuna	noun	Latin	a blank gap or missing partlagniappe	noun	American French	a small giftlahar	noun	Javanese	an avalanche of volcanic water and mud down the slopes of a volcanolamasery	noun	French	a monastery for lamaslambent	adjective	Latin	softly bright or radiantlamia	noun	Middle English	a corpse that rises at night to drink the blood of the livinglamprey	noun	Middle English	primitive eellike freshwater or anadromous cyclostome having round sucking mouth with a rasping tongueLancashire	noun	England	a historical area of northwestern England on the Irish Sealanceolate	adjective	Late Latin	of a leaf shapelangouste	noun	French	large edible marine crustacean having a spiny carapace but lacking the large pincers of true lobsterslaniary	adjective	Latin	of or relating to a pointed conical toothlaocoon	noun	Latin	the priest of Apollo who warned the Trojans to beware of Greeks bearing gifts when they wanted to accept the Trojan Horselarceny	noun	Middle English	the act of taking something from someone unlawfullylarghetto	adjective	Italian	less slow and broad than largolarghissimo	adjective	Italian	as slow and broad as possiblelaryngitis	noun	New Latin	inflammation of the mucous membrane of the larynxlassitude	noun	Middle English	weakness characterized by a lack of vitality or energylatke	noun	Yiddish	made of grated potato and egg with a little flourlaurel	noun	Middle English	a wreath of laurel foliage worn on the head as an emblem of victorylavabo	noun	Latin	a basin for washing the handslavation	noun	Middle English	the work of cleansinglavatory	noun	Middle English	a toilet that is cleaned of waste by the flow of water through itlavender	adjective	Middle English	of a pale purple colorleaven	noun	Middle English	an influence that works subtly to lighten or modify somethinglebensraum	noun	German	space sought for occupation by a nation whose population is expandinglecithin	noun	International Scientific Vocabulary	a yellow phospholipid essential for the metabolism of fatslecture	noun	Middle English	teaching by giving a discourse on some subjectlederhosen	noun	German	leather shorts often worn with suspenderslegato	adjective	Italian	without breaks between notes