Word	Part of Speech	Origin	Definitioncontemn	verb	Middle English	look down on with disdaincontrariety	noun	Middle English	the relation between contrariescontravene	verb	Middle French or Late Latin	deny the truth ofcontretemps	noun	French	an awkward clashcontumacy	noun	Middle English	obstinate rebelliousness and insubordinationcontumely	noun	Middle English	a rude expression intended to offend or hurtcontusion	noun	Middle English	the action of bruisingconvalesce	verb	Latin	get over an illness or shockconvalescent	adjective	Latin	returning to health after illness or debilityconvection	noun	Late Latin	the transfer of heat through a fluid caused by molecular motionconvivial	adjective	Late Latin	occupied with or fond of the pleasures of good companyconvivially	adverb	Late Latin	in a convivial mannercopious	adjective	Middle English	large in number or quantitycoracle	noun	Welsh	a small rounded boat made of hides stretched over a wicker framecordate	adjective	New Latin	shaped like a heartcorduroys	noun	origin unknown	cotton trousers made of corduroy clothcoreopsis	noun	New Latin	any of numerous plants of the genus Coreopsis having a profusion of showy usually yellow daisylike flowers over long periodscorgi	noun	Welsh	either of two Welsh breeds of long-bodied short-legged dogs with erect ears and a fox-like headcoriaceous	adjective	Late Latin	resembling or made to resemble leathercoriander	noun	Middle English	parsley-like herb used as seasoning or garnishcormorant	noun	Middle English	large voracious dark-colored long-necked seabird with a distensible pouch for holding fishcornice	noun	Middle French	the topmost projecting part of an entablaturecorollary	noun	Middle English	an inference that follows directly from the proof of another propositioncoronach	noun	Scottish Gaelic	a song or hymn of mourning composed or performed as a memorial to a dead personcoronet	noun	Middle French	margin between the skin of the pastern and the horn of the hoofcorporeal	adjective	Middle English	having material or physical form or substancecorposant	noun	Portuguese	an electrical discharge accompanied by ionization of surrounding atmospherecorpulent	adjective	Middle English	excessively fatcorpuscle	noun	Latin	either of two types of cells and sometimes including plateletscorrelation	noun	Medieval Latin	a statistical relation between two or more variables such that systematic changes in the value of one variable are accompanied by systematic changes in the othercorrigenda	noun	Latin	a list of printing errors in a book along with their correctionscorrigendum	noun	Latin	a printer's errorcorruptible	adjective	Middle English	capable of being corruptedcorsair	noun	Middle French and Old Italian	a swift pirate shipcortege	noun	French	the group following and attending to some important personcorymb	noun	French	flat-topped or convex inflorescence in which the individual flower stalks grow upward from various points on the main stem to approximately the same heightcoryza	noun	Late Latin	an inflammation of the mucous membrane lining the nosecoterie	noun	French	an exclusive circle of people with a common purposecotyledon	noun	New Latin	embryonic leaf in seed-bearing plantscoulisse	noun	French	a timber member grooved to take a sliding panelcoulomb	noun	French	the unit of electric charge equal to the quantity of electricity transferred by a current of one ampere in one secondcounsel	noun	Middle English	something that provides direction or advice as to a decision or course of actioncountenance	noun	Middle English	the appearance conveyed by a person's facecountervail	verb	Middle English	oppose and mitigate the effects of by contrary actionscouture	noun	French	high fashion designing and dressmakingcowardice	noun	Middle English	the trait of lacking couragecrapaud	noun	Middle English	large toothed frog of South America and Central America resembling the bullfrogcravat	noun	French	neckwear worn in a slipknot with long ends overlapping vertically in frontcredenza	noun	Italian	a kind of sideboard or buffetcredo	noun	Middle English	any system of principles or beliefscrepitate	verb	Latin	make a crackling soundcrescendo	adjective	Italian	gradually increasing in volumecretin	noun	French	a person of subnormal intelligencecretonne	noun	French	an unglazed heavy fabriccriminologist	noun	Italian	a specialist in criminologycrinoline	noun	French	a stiff coarse fabric used to stiffen hats or clothingcriollo	noun	Spanish	cocoa of superior qualitycriterion	noun	Greek	the ideal in terms of which something can be judgedcrocus	noun	Middle English	any of numerous low-growing plants of the genus Crocus having slender grasslike leaves and white or yellow or purple flowerscroissant	noun	French	very rich flaky crescent-shaped rollcromlech	noun	Welsh	a prehistoric megalithic tomb typically having two large upright stones and a capstonecrucial	adjective	French	of extreme importancecruciferous	adjective	Late Latin	of or relating to or belonging to the plant family Cruciferaecryptococcosis	noun	New Latin	a fungal infection characterized by nodular lesions--first in the lungs and spreading to the nervous systemctenoid	adjective	International Scientific Vocabulary	resembling a combcubicle	noun	Latin	small area set off by walls for special usecubitiere	noun	French	body armor that protects the elbowcucurbit	noun	Middle English	any plant of the family Cucurbitaceaeculinary	adjective	Latin	of or relating to or used in cookingculpable	adjective	Middle English	deserving blame or censure as being wrong or evil or injuriouscummerbund	noun	Hindi and Urdu	a broad pleated sash worn as formal dress with a tuxedocumulus	noun	Latin	a globular cloudcuneate	adjective	Latin	of a leaf shapecurrant	noun	Middle English	any of several tart red or black berries used primarily for jellies and jamscursor	noun	Latin	indicator consisting of a movable spot of light on a visual displaycurtilage	noun	Middle English	the enclosed land around a house or other buildingcustard	noun	Middle English	sweetened mixture of milk and eggs baked or boiled or frozencyanosis	noun	New Latin	a bluish discoloration of the skin and mucous membranescybernetics	noun	Greek	the field of science concerned with processes of communication and controlcygnet	noun	Middle English	a young swancynosure	noun	Middle French and Latin	something that strongly attracts attention and admirationcytology	noun	International Scientific Vocabulary	the branch of biology that studies the structure and function of cellscytolysis	noun	New Latin	pathological breakdown of cells by the destruction of their outer membranedachshund	noun	German	small long-bodied short-legged German breed of dog having a short sleek coat and long drooping earsdaedal	adjective	Latin	complex and ingenious in design or functiondahlia	noun	New Latin	any of several plants of or developed from the species Dahlia pinnata having tuberous roots and showy rayed variously colored flower headsdais	noun	Middle English	a platform raised above the surrounding level to give prominence to the person on itDarjeeling	noun	India	a fine variety of black tea grown in northern Indiadearth	noun	Middle English	an insufficient quantity or numberdebacle	noun	French	a sudden and violent collapsedebenture	noun	Middle English	a certificate or voucher acknowledging a debtdebilitate	verb	Latin	make weakdebilitated	adjective	Latin	lacking strength or vigordebridement	noun	French	surgical removal of foreign material and dead tissue from a wound in order to prevent infection and promote healingdebris	noun	French	the remains of something that has been destroyed or broken updebutante	noun	French	a young woman making her debut into societydecadence	noun	Middle French	the state of being degenerate in mental or moral qualitiesdecedent	noun	Latin	someone who is no longer alivedecennary	noun	Latin	a period of 10 yearsdecibel	noun	International Scientific Vocabulary	a logarithmic unit of sound intensitydeciduous	adjective	Latin	shedding foliage at the end of the growing seasondecile	noun	Latin	any of nine points that divided a distribution of ranked scores into equal intervals where each interval contains one-tenth of the scoresdecimal	adjective	French	divided by tens or hundredsdecimation	noun	Latin	destroying or killing a large part of the populationdeclination	noun	Middle English	a polite refusal of an invitationdecorticate	verb	Latin	remove the cortex ofdecorum	noun	Latin	propriety in manners and conductdecoupage	noun	French	the art of decorating a surface with shapes or pictures and then coating it with vanish or lacquerdecrement	noun	Latin	the amount by which something decreasesdecussate	adjective	Latin	crossed or intersected in the form of an Xdefervescence	noun	German	abatement of a fever as indicated by a reduction in body temperaturedefunct	adjective	Latin	having ceased to exist or livedehiscence	noun	New Latin	release of material by splitting open of an organ or tissuedeixis	noun	Greek	the function of pointing or specifying from the perspective of a participant in an act of speech or writingdelectable	adjective	Middle English	capable of arousing desiredelegate	noun	Middle English	a person appointed or elected to represent othersdeleterious	adjective	Greek	harmful to living thingsdeliquesce	verb	Latin	melt or become liquid by absorbing moisture from the airdelirium	noun	Latin	a usually brief state of excitement and mental confusion often accompanied by hallucinationsdelphinium	noun	New Latin	any plant of the genus Delphinium having palmately divided leaves and showy spikes of variously colored spurred flowersdeluge	noun	Middle English	the rising of a body of water and its overflowing onto normally dry landdemantoid	noun	German	a green andradite used as a gemstonedemarche	noun	French	a move or step or maneuver in political or diplomatic affairsdemesne	noun	Middle English	territory over which rule or control is exerciseddemitasse	noun	French	small coffee cupdemiurge	noun	Late Latin	"a subordinate deity, in some philosophies the creator of the universe"demoiselle	noun	French	small brilliantly colored tropical marine fishes of coral reefsdemotic	adjective	Greek	of or for the common peopledemulcent	adjective	Latin	having a softening or soothing effect especially to the skindemure	adjective	Middle English	affectedly modest or shy especially in a playful or provocative waydengue	noun	American Spanish	an infectious disease of the tropics transmitted by mosquitoes and characterized by rash and aching head and jointsdenier	noun	Middle English	one who deniesdenigrate	verb	Latin	charge falsely or with malicious intentdenigration	noun	Latin	a belittling commentdenouement	noun	French	the final resolution of the main complication of a literary or dramatic workdentifrice	noun	Middle English	a substance for cleaning the teethdepilation	noun	Middle French or Medieval Latin	the act of removing hairderogation	noun	Middle English	the partial taking away of the effectiveness of a lawdesiccate	adjective	Latin	lacking vitality or spiritdesideratum	noun	Latin	something desired as a necessitydesquamate	verb	Latin	peel off in scalesdestitute	adjective	Middle English	poor enough to need help from othersdesuetude	noun	Middle English	a state of inactivity or disusedesultory	adjective	Latin	marked by lack of definite plan or regularity or purposedetente	noun	French	the easing of tensions or strained relationsdetritus	noun	French	loose material that is worn away from rocksdeuteranopia	noun	New Latin	dichromacy characterized by a lowered sensitivity to green light resulting in an inability to distinguish green and purplish-reddeuterium	noun	New Latin	an isotope of hydrogen which has one neutrondevouring	adjective	Middle English	ardently or excessively desirousdexterity	noun	Middle French or Latin	adroitness in using the handsdiabetes	noun	Latin	any of several metabolic disorders marked by excessive urination and persistent thirstdiadem	noun	Middle English	an ornamental jewelled headdress signifying sovereigntydiagrammatic	adjective	Greek	shown or represented by diagramsdialysis	noun	New Latin	separation of substances in solution by means of their unequal diffusion through semipermeable membranesdiamantine	adjective	French	consisting of diamonds or resembling diamondsdiapason	noun	Middle English	either of the two main stops on a pipe organdiapedesis	noun	New Latin	passage of blood cells through intact capillary walls and into the surrounding tissuediaphanous	adjective	Medieval Latin	so thin as to transmit lightdiaphoresis	noun	Late Latin	the process of the sweat glands of the skin secreting a salty fluiddiaspora	noun	Greek	the dispersion or spreading of something that was originally localizeddiathermy	noun	International Scientific Vocabulary	a method of physical therapy that involves generating local heat in body tissues by high-frequency electromagnetic currentsdichondra	noun	New Latin	a creeping perennial herb with hairy stems and orbicular to reniform leaves and small white to greenish flowersdichotomy	noun	Greek	being twofolddictum	noun	Latin	an authoritative declarationdidacticism	noun	Greek	communication that is suitable for or intended to be instructivedido	noun	Latin	a princess of Tyre who was the founder and queen of Carthagedieffenbachia	noun	New Latin	evergreen perennial herbs of tropical America with lush foliage and poisonous sapdiffident	adjective	Middle English	lacking self-confidencedigitalis	noun	New Latin	a powerful cardiac stimulant obtained from foxglovedilatory	adjective	Middle English	wasting timedilemma	noun	Late Latin	state of uncertainty or perplexity especially as requiring a choice between equally unfavorable optionsdiligent	adjective	Middle English	characterized by care and perseverance in carrying out tasksdiluent	noun	Latin	a diluting agentDimetrodon	noun	New Latin	carnivorous dinosaur of the Permian in North America having a crest or dorsal saildiocese	noun	Middle English	the territorial jurisdiction of a bishopdiorama	noun	French	a picture representing a continuous scenediphtheria	noun	New Latin	acute contagious infection caused by the bacterium Corynebacterium diphtheriaediphthong	noun	Middle English	a vowel sound that starts near the articulatory position for one vowel and moves toward the position for anotherdiplodocus	noun	New Latin	a huge quadrupedal herbivore with long neck and taildiptych	noun	Late Latin	a painting or carving on two panelsdirigible	adjective	Latin	capable of being steered or directeddiscreet	adjective	Middle English	marked by prudence or modesty and wise self-restraintdiscrete	adjective	Middle English	constituting a separate entity or partdiscursively	adverb	Medieval Latin	in a rambling mannerdisembark	verb	Middle French	go ashoredisguise	noun	Middle English	the act of concealing the identity of something by modifying its appearancedisparage	verb	Middle English	express a negative opinion ofdisparity	noun	Middle English	inequality or difference in some respectdispel	verb	Middle English	force to go awaydisquisition	noun	Latin	an elaborate analytical or explanatory essay or discussiondissemble	verb	Middle English	behave unnaturally or affectedlydissentient	noun	Latin	someone expressing dissentdissilient	adjective	Latin	bursting open with force, as do some ripe seed vesselsdissimilitude	noun	Middle English	dissimilarity evidenced by an absence of likenessdissimulate	verb	Middle English	hide from other peopledissonant	adjective	Middle English	lacking in harmonydissuade	verb	Middle French or Latin	turn away from by persuasiondistraught	adjective	Middle English	deeply agitated especially from emotiondithyramb	noun	Greek	a passionate hymndiurnal	adjective	Middle English	having a daily cycle or occurring every daydivagate	verb	Late Latin	"lose clarity or turn aside especially from the main subject of attention or course of argument in writing, thinking, or speaking"divergent	adjective	Latin	tending to move apart in different directionsdivers	adjective	Middle English	many and differentdivertimento	noun	Italian	a musical composition in several movementsdivulge	verb	Middle English	make known to the public information that was previously known only to a few people or that was meant to be kept a secretdocility	noun	Latin	the trait of being agreeably submissive and manageabledoctrinaire	adjective	French	stubbornly insistent on theory without regard for practicality or suitabilitydodecahedron	noun	Greek	any polyhedron having twelve plane facesdolabriform	adjective	Latin	having the shape of the head of an ax or cleaverdolomite	noun	French	a light colored mineral consisting of calcium magnesium carbonatedomestic	adjective	Middle English	produced in a particular countrydominant	adjective	Middle French or Latin	exercising influence or controldormition	noun	Middle French	celebration in the Eastern Orthodox church of the Virgin Mary's being taken up into heaven when her earthly life endeddormitory	noun	Middle English	a college or university building containing living quarters for studentsdorsal	adjective	Late Latin	belonging to or on or near the back or upper surface of an animal or organ or partdossier	noun	French	a collection of papers containing detailed information about a particular person or subjectdowager	noun	Middle French	a widow holding property received from her deceased husbanddoxology	noun	Medieval Latin	a hymn or verse in Christian liturgy glorifying Goddoyen	noun	French	a man who is the senior member of a groupdraconian	adjective	Latin	of or relating to Draco or his harsh code of lawsdragoman	noun	Middle English	an interpreter and guide in the Near Eastdragoon	noun	French	a member of a European military unit formerly composed of heavily armed cavalrymendressage	noun	French	maneuvers of a horse in response to body signals by the riderdrivel	noun	Middle English	a worthless messagedrone	noun	Middle English	stingless male bee in a colony of social bees whose sole function is to mate with the queendrosophila	noun	New Latin	small fruit fly used by Thomas Hunt Morgan in studying basic mechanisms of inheritancedrumlin	noun	Irish	a mound of glacial driftdubiety	noun	Late Latin	the state of being unsure of somethingdubiously	adverb	Latin	in a doubtful mannerduchy	noun	Middle English	the domain controlled by a duke or duchessdudgeon	noun	origin unknown	a feeling of intense indignationdudgeon	noun	origin unknown	a feeling of intense indignationduenna	noun	Spanish	a woman chaperondulcet	adjective	Middle English	pleasing to the eardulcify	verb	Late Latin	make sweeter in tastedulcinea	noun	Spanish	a woman who is a man's sweetheartduplicity	noun	Middle English	acting in bad faithduress	noun	Middle English	compulsory force or threatduvet	noun	French	a soft quilt usually filled with the down of the eiderdyskinesia	noun	New Latin	abnormality in performing voluntary muscle movementsdyslexia	noun	New Latin	impaired ability to learn to readdyspepsia	noun	Latin	a disorder of digestive function characterized by discomfort or heartburn or nauseadysphagia	noun	New Latin	condition in which swallowing is difficult or painfuldysphasia	noun	New Latin	an impairment of language that is usually due to brain damagedysphonia	noun	New Latin	speech disorder attributable to a disorder of phonationdysphoria	noun	New Latin	abnormal depression and discontentdysthymia	noun	New Latin	mild chronic depressiondystrophy	noun	New Latin	any degenerative disorder resulting from inadequate or faulty nutritionearnest	adjective	Middle English	characterized by a firm and humorless belief in the validity of your opinionsebullient	adjective	Latin	joyously unrestrainedecchymosis	noun	New Latin	the escape of blood from ruptured blood vessels into the surrounding tissue to form a purple or black-and-blue spot on the skinecclesiastical	adjective	Middle English	of or associated with a churchecdysis	noun	New Latin	periodic shedding of the cuticle in arthropods or the outer skin in reptilesecesis	noun	New Latin	the process by which a plant or animal becomes established in a new habitatechelon	noun	French	a diffraction grating consisting of a pile of plates of equal thickness arranged stepwise with a constant offsetechidna	noun	New Latin	a burrowing monotreme mammal covered with spines and having a long snout and claws for hunting ants and termitesechinacea	noun	New Latin	small genus of North American coarse perennial herbsechinoderm	noun	New Latin	marine invertebrates with tube feet and five-part radially symmetrical bodiesecholalia	noun	New Latin	mechanical and meaningless repetition of the words of another personecht	adjective	German	not fake or counterfeiteclectic	adjective	Greek	selecting what seems best of various styles or ideaseclipse	noun	Middle English	one celestial body obscures anothereclogue	noun	Middle English	a short descriptive poem of rural or pastoral lifeecphonesis	noun	Greek	an exclamatory rhetorical deviceecru	noun	French	a very light brownectoparasite	noun	International Scientific Vocabulary	any external parasitic organismedacious	adjective	Latin	devouring or craving food in great quantitiesedelweiss	noun	German	alpine perennial plant native to Europe having leaves covered with whitish down and small flower heads held in stars of glistening whitish bractsedentulous	adjective	Latin	having lost teethedifice	noun	Middle English	a structure that has a roof and walls and stands more or less permanently in one placeedulcorate	verb	New Latin	make sweeter in tasteeffendi	noun	Turkish	a former Turkish term of respectefficient	adjective	Middle English	being effective without wasting time or effort or expenseeffluvium	noun	Latin	a foul-smelling outflow or vaporeffrontery	noun	French	audacious behavior that you have no right toegalitarian	adjective	French	favoring social equalityeglantine	noun	Middle English	Eurasian rose with prickly stems and fragrant leaves and bright pink flowers followed by scarlet hipsegregious	adjective	Latin	conspicuously and outrageously bad or reprehensibleegress	noun	Latin	the act of coming outeidetic	adjective	Greek	of visual imagery of almost photographic accuracyeinsteinium	noun	New Latin	a radioactive transuranic element produced by bombarding plutonium with neutronseisegesis	noun	Greek	personal interpretation of a text using your own ideaseland	noun	Afrikaans	either of two large African antelopes of the genus Taurotragus having short spirally twisted horns in both sexeselaterid	noun	New Latin	any of various widely distributed beetleselectroencephalograph	noun	International Scientific Vocabulary	medical instrument that records electric currents generated by the braineleemosynary	adjective	Medieval Latin	generous in assistance to the poorelicitation	noun	Latin	stimulation that calls up a particular class of behaviorselision	noun	Late Latin	omission of a sound between two wordselocution	noun	Middle English	an expert manner of speaking involving control of voice and gestureelucidate	verb	Late Latin	make free from confusion or ambiguityelysium	noun	Latin	the abode of the blessed after deathemaciated	adjective	Latin	very thin especially from disease or hunger or coldembargo	noun	Spanish	a government order imposing a trade barrierembezzled	adjective	Middle English	taken for your own use in violation of a trustembezzlement	noun	Middle English	the fraudulent appropriation of funds or property entrusted to your care but actually owned by someone elseembouchure	noun	French	the aperture of a wind instrument into which the player blows directlyembrasure	noun	French	an opening for firing throughembrocation	noun	Middle English	a medicinal liquid that is rubbed into the skin to relieve muscular stiffness and painemeritus	adjective	Latin	honorably retired from assigned duties and retaining your title along with the additional title `emeritus' as in `professor emeritus'emery	noun	Middle English	a hard grey-black mineral consisting of corundum and either hematite or magnetiteemetic	noun	Latin	a medicine that induces nausea and vomitingemigrate	verb	Latin	leave one's country of residence for a new oneemissary	noun	Latin	someone sent on a mission to represent the interests of someone elseemolument	noun	Middle English	compensation received by virtue of holding an office or having employmentempennage	noun	French	the rear part of an aircraftemperor	noun	Middle English	large moth of temperate forests of Eurasia having heavily scaled transparent wingsemphysema	noun	New Latin	an abnormal condition of the lungs marked by decreased respiratory functionemphysematous	adjective	New Latin	relating to or resembling or being emphysemaempyreal	adjective	Late Latin	inspiring aweemulsion	noun	New Latin	a light-sensitive coating on paper or filmenamel	noun	Middle English	any smooth glossy coating that resembles ceramic glazeenatic	adjective	Latin	related on the mother's sideenceinte	adjective	French	in an advanced stage of pregnancyencephalon	noun	New Latin	that part of the central nervous system that includes all the higher nervous centersencolure	noun	French	the mane of a horseencomium	noun	Latin	a formal expression of praiseencroachment	noun	Middle English	influencing stronglyendocrine	adjective	International Scientific Vocabulary	of or belonging to endocrine glands or their secretionsendorphin	noun	International Scientific Vocabulary	a neurochemical occurring naturally in the brain and having analgesic propertiesenervate	verb	Latin	weaken mentally or morallyenervated	adjective	Latin	lacking strength or vigorenfilade	noun	French	gunfire directed along the length rather than the breadth of a formationenforceable	adjective	Middle English	capable of being enforcedenmity	noun	Middle English	the feeling of a hostile person