Word	Part of Speech	Origin	Definitionpoinsettia	noun	New Latin	tropical American plant having poisonous milk and showy tapering usually scarlet petallike leaves surrounding small yellow flowerspoivrade	noun	French	for venison: brown sauce with sauteed vegetables and trimmings and marinade and plenty of pepperpolemic	adjective	French	of or involving dispute or controversypoliomyelitis	noun	New Latin	an acute viral disease marked by inflammation of nerve cells of the brain stem and spinal cordpolitesse	noun	French	courtesy towards womenpollex	noun	New Latin	the thick short innermost digit of the forelimbpolonaise	noun	French	a woman's dress with a tight bodice and an overskirt drawn back to reveal a colorful underskirtpoltergeist	noun	German	a ghost that announces its presence with rapping and the creation of disorderpolyglot	adjective	Greek	having a command of or composed in many languagespolymer	noun	International Scientific Vocabulary	a naturally occurring or synthetic compound consisting of large molecules made up of a linked series of repeated simple monomerspolyphony	noun	Greek	music arranged in parts for several voices or instrumentspolysaccharide	noun	International Scientific Vocabulary	any of a class of carbohydrates whose molecules contain chains of monosaccharide moleculespolysemous	adjective	Late Latin	of wordspolysyllabic	adjective	Medieval Latin	long and ponderouspolysyndeton	noun	New Latin	using several conjunctions in close succession, especially where some might be omittedpomatum	noun	New Latin	hairdressing consisting of a perfumed oil or ointmentpongee	noun	Chinese	a soft thin cloth woven from raw silkpontificate	noun	Medieval Latin	the government of the Roman Catholic Churchpontificate	noun	Medieval Latin	the government of the Roman Catholic Churchpopinjay	noun	Middle English	archaicporcelain	noun	Middle French	ceramic ware made of a more or less translucent ceramicporcupine	noun	Middle English	relatively large rodents with sharp erectile bristles mingled with the furporphyry	noun	Middle English	any igneous rock with crystals embedded in a finer groundmass of mineralsportcullis	noun	Middle English	gate consisting of an iron or wooden grating that hangs in the entry to a castle or fortified townportico	noun	Italian	a porch or entrance to a building consisting of a covered and often columned areaportmanteau	noun	Middle French	a large travelling bag made of stiff leatherportulaca	noun	New Latin	a plant of the genus Portulaca having pink or red or purple or white ephemeral flowersposset	noun	Middle English	sweet spiced hot milk curdled with ale or beerposterity	noun	Middle English	all future generationspostern	noun	Middle English	a small gate in the rear of a fort or castlepostulate	noun	Medieval Latin	a proposition that is accepted as true in order to provide a basis for logical reasoningpostulation	noun	Medieval Latin	a declaration of something self-evidentpotable	adjective	Middle English	suitable for drinkingpotassium	noun	New Latin	a light soft silver-white metallic element of the alkali metal grouppotpourri	noun	French	a jar of mixed flower petals and spices used as perfumepoultice	noun	Middle English	a medical dressing consisting of a soft heated mass of meal or clay that is spread on a cloth and applied to the skin to treat inflamed areas or improve circulation etc.pourboire	noun	French	a relatively small amount of money given for services renderedpragmatic	adjective	Latin	of or concerning the theory of pragmatismprecative	adjective	Late Latin	expressing entreaty or supplicationprecautionary	adjective	French	taken in advance to protect against possible danger or failureprecedent	adjective	Middle English	"preceding in time, order, or significance"precept	noun	Middle English	a doctrine that is taughtprecipice	noun	French	a very steep cliffpreclude	verb	Latin	"make impossible, especially beforehand"precocious	adjective	Latin	appearing or developing earlyprecursor	noun	Middle English	a person who goes before or announces the coming of anotherpredecessor	noun	Middle English	one who precedes you in timepredilection	noun	French	a predisposition in favor of somethingpreeminent	adjective	Middle English	greatest in importance or degree or significance or achievementpreference	noun	Middle English	grant of favor or advantage to one over anotherprelude	noun	Middle French	music that precedes a fugue or introduces an act in an operapremonition	noun	Middle English	an early warning about a future eventprerogative	noun	Middle English	a right reserved exclusively by a particular person or grouppresage	noun	Middle English	a foreboding about what is about to happenprescience	noun	Middle English	the power to foresee the futureprescient	adjective	Middle English	perceiving the significance of events before they occurprestidigitator	noun	French	someone who performs magic tricks to amuse an audiencepretentious	adjective	French	making claim to or creating an appearance of importance or distinctionpreterition	noun	Late Latin	suggesting by deliberately concise treatment that much of significance is omittedprevail	verb	Middle English	use persuasion successfullyprevalent	adjective	Latin	encountered generally especially at the present timeprevaricate	verb	Latin	be deliberately ambiguous or unclear in order to mislead or withhold informationprimitive	adjective	Middle English	used of preliterate or tribal or nonindustrial societiesprimordial	adjective	Middle English	having existed from the beginningpristine	adjective	Latin	immaculately clean and unusedprivet	noun	origin unknown	a Eurasian deciduous shrub of the olive family with semievergreen leaves and small white flowers that is widely used for hedgesprivilege	noun	Middle English	a special advantage or immunity or benefit not enjoyed by allproboscis	noun	Latin	a long flexible snout as of an elephantprocrastinate	verb	Latin	postpone doing what one should be doingprofane	adjective	Middle English	not holy because unconsecrated or impure or defiledproficient	adjective	Latin	having or showing knowledge and skill and aptitudeprofuse	adjective	Middle English	produced or growing in extreme abundanceprogenitor	noun	Middle English	an ancestor in the direct lineprolegomenon	noun	Greek	a preliminary discussion inserted at the beginning of a book or treatiseprolepsis	noun	Greek	anticipating and answering objections in advanceproletarian	adjective	Latin	belonging to or characteristic of the proletariatprolific	adjective	French	bearing in abundance especially offspringprolix	adjective	Middle English	tediously prolonged or tending to speak or write at great lengthprolusory	adjective	Latin	of or relating to or having the character of a prolusionpromenade	noun	French	a march of all the guests at the opening of a formal dancepromissory	adjective	Middle English	relating to or having the character of a promisepromulgate	verb	Latin	to proclaimpromulgator	noun	Latin	one who promulgates lawspronounceable	adjective	Middle English	capable of being uttered or pronouncedpropaedeutic	adjective	Greek	preceding and preparing for somethingpropagate	verb	Latin	multiply sexually or asexuallypropinquity	noun	Middle English	the property of being close togetherpropitious	adjective	Middle English	presenting favorable circumstancesproprioceptive	adjective	Latin	of or relating to proprioceptionprorogue	verb	Middle English	adjourn by royal prerogativeproscenium	noun	Latin	the wall that separates the stage from the auditorium in a modern theaterproscription	noun	Middle English	rejection by means of an act of banishing or proscribing someoneproselyte	noun	Middle English	a new convertprosopopoeia	noun	Latin	representing an abstract quality or idea as a person or creatureprospectus	noun	Latin	a formal written offer to sell securities that sets forth a plan for a business enterpriseprospicience	noun	Latin	seeing aheadprotagonist	noun	Greek	the principal character in a work of fictionproteus	noun	Latin	type genus of the Proteidaeproteus	noun	Latin	type genus of the Proteidaeprotocol	noun	Middle French	code of correct conductprotuberant	adjective	Late Latin	curving outwardprovender	noun	Middle English	a stock or supply of foodsproviso	noun	Middle English	a stipulated conditionprowess	noun	Middle English	a superior skill that you can learn by study and practice and observationpruritus	noun	Latin	an intense itching sensation that can have various causespsalmody	noun	Middle English	the act of singing psalms or hymnspsephologist	noun	Greek	a sociologist who studies election trendspsephology	noun	Greek	the branch of sociology that studies election trendspsittacosis	noun	New Latin	an atypical pneumonia caused by a rickettsia microorganism and transmitted to humans from infected birdspsychoanalysis	noun	New Latin	a set of techniques for exploring underlying motives and a method of treating various mental disorderspsyllium	noun	New Latin	plantain of Mediterranean regions whose seeds swell and become gelatinous when moist and are used as a mild laxativeptomaine	noun	Italian	a term for food poisoning that is no longer in scientific useptosis	noun	New Latin	drooping of the upper eyelid caused by muscle paralysis and weaknessptyalin	noun	Greek	an amylase secreted in salivapuerile	adjective	French or Latin	of or characteristic of a childpuerpera	noun	Latin	a woman in childbirth or shortly thereafterpugnacious	adjective	Latin	ready and able to resort to force or violencepulchritude	noun	Middle English	physical beautypulchritudinous	adjective	Middle English	used of persons onlypullet	noun	Middle English	young hen usually less than a year oldpullulate	verb	Latin	breed freely and abundantlypulmonary	adjective	Latin	relating to or affecting the lungspulverize	verb	Middle English	make into a powder by breaking up or cause to become dustpumice	noun	Middle English	a light glass formed on the surface of some lavaspunctuate	verb	Medieval Latin	insert punctuation marks intopunitive	adjective	French	inflicting punishmentpurblind	adjective	Middle English	lacking in insight or discernmentpurlieu	noun	Middle English	an outer adjacent area of any placepurslane	noun	Middle English	a plant of the family Portulacaceae having fleshy succulent obovate leaves often grown as a potherb or salad herbpusillanimous	adjective	Late Latin	lacking in courage and manly strength and resolutionputative	adjective	Middle English	commonly put forth or accepted as true on inconclusive groundsputrescent	adjective	Latin	becoming putridputsch	noun	German	a sudden and decisive change of government illegally or by forcepyelonephritis	noun	New Latin	inflammation of the kidney and its pelvis caused by bacterial infectionpylon	noun	Greek	a large vertical steel tower supporting high-tension power linespyracantha	noun	New Latin	any of various thorny shrubs of the genus Pyracantha bearing small white flowers followed by hard red or orange-red berriespyre	noun	Latin	wood heaped for burning a dead body as a funeral ritepyrethrum	noun	Latin	used in former classifications for plants later placed in genus Chrysanthemum and now often included in genus Tanacetumpyrexia	noun	New Latin	a rise in the temperature of the bodypyrite	noun	Latin	a common mineral that has a pale yellow colorpyroligneous	adjective	French	"of a substance produced by the effect of heat on wood, especially by destructive distillation"pyromaniac	noun	New Latin	a person with a mania for setting things on firepyrope	noun	Middle English	a deep red garnet used as a gemstonepyrosis	noun	New Latin	a painful burning sensation in the chest caused by gastroesophageal refluxPyrrhic	adjective	Latin	of or relating to or resembling Pyrrhus or his exploitsPyrrhic	adjective	Latin	of or relating to or resembling Pyrrhus or his exploitsquadrille	noun	French	a square dance of 5 or more figures for 4 or more couplesquaff	noun	origin unknown	a hearty draftquandary	noun	origin unknown	state of uncertainty or perplexity especially as requiring a choice between equally unfavorable optionsquarrel	noun	Middle English	an arrow that is shot from a crossbowquatercentenary	noun	Latin	the 400th anniversaryquattrocento	noun	Italian	the 15th century in Italian art and literaturequiaquia	noun	American Spanish	small fusiform fish of western Atlanticquiddity	noun	Middle English	the essence that makes something the kind of thing it is and makes it different from any otherquidnunc	noun	Latin	a person who meddles in the affairs of othersquietus	noun	Middle English	euphemisms for deathquinine	noun	Spanish	a bitter alkaloid extracted from chinchona barkquintal	noun	Middle English	a unit of weight equal to 100 kilogramsquintessence	noun	Middle English	the most typical example or representative of a typequipu	noun	Spanish	calculator consisting of a cord with attached cordsquire	noun	Middle English	a quantity of paperquodlibet	noun	Middle English	an issue that is presented for formal disputationquondam	adjective	Latin	belonging to some prior timequorum	noun	Middle English	a gathering of the minimal number of members of an organization to conduct businessquotidian	adjective	Middle English	found in the ordinary course of eventsraconteur	noun	French	a person skilled in telling anecdotesradical	adjective	Middle English	especially of leavesradicchio	noun	Italian	prized variety of chicory having globose heads of red leavesradix	noun	Latin	the positive integer that is equivalent to one in the next higher counting placeragout	noun	French	well-seasoned stew of meat and vegetablesraillery	noun	French	light teasing reparteeraiment	noun	Middle English	especially fine or decorative clothingraita	noun	Hindi and Urdu	an Indian side dish of yogurt and chopped cucumbers and spicesrallentando	adjective	Italian	gradually decreasing in temporamate	adjective	Latin	having branchesrampant	adjective	Middle English	having a lush and unchecked growthrancid	adjective	Latin	having a rank smell or taste usually due to a chemical change or decompositionrancor	noun	Middle English	a feeling of deep and bitter anger and ill-willranunculus	noun	New Latin	"annual, biennial or perennial herbs: buttercup"rapacious	adjective	Latin	excessively greedy and graspingrappel	noun	French	a descent of a vertical cliff or wall made by using a doubled rope that is fixed to a higher point and wrapped around the bodyrapport	noun	French	a relationship of mutual understanding or trust and agreement between peoplerapprochement	noun	French	the reestablishing of cordial relationsrariora	noun	New Latin	rare collector's itemsratafia	noun	French	macaroon flavored with ratafia liqueurrataplan	noun	French	the sound made by beating a drumratiocinate	verb	Latin	reason methodologically and logicallyraucous	adjective	Latin	unpleasantly loud and harshravigote	noun	French	veloute sauce seasoned with herbs and shallots and capersrealgar	noun	Middle English	a rare soft orange mineral consisting of arsenic sulphiderealpolitik	noun	German	politics based on practical rather than moral or ideological considerationsrebarbative	adjective	French	serving or tending to repelrebus	noun	Latin	a puzzle where you decode a message consisting of pictures representing syllables and wordsrecalcitrant	adjective	Late Latin	marked by stubborn resistance to authorityrecant	verb	Latin	formally reject or disavow a formerly held belief, usually under pressurerecapitulate	verb	Late Latin	summarize brieflyrecede	verb	Middle English	become faint or more distantreceptacle	noun	Middle English	a container that is used to put or keep things inrecidivist	noun	French	someone who lapses into previous undesirable patterns of behaviorrecipient	noun	Latin	a person who gets somethingreciprocal	adjective	Latin	of or relating to the multiplicative inverse of a quantity or functionreclusive	adjective	Middle English	providing privacy or seclusionrecognizance	noun	Middle English	a security entered into before a court with a condition to perform some act required by lawrecommended	adjective	Middle English	mentioned as worthy of acceptancereconcilable	adjective	Middle English	capable of being reconciledrecondite	adjective	Latin	difficult to penetraterecreant	adjective	Middle English	having deserted a cause or principlerecriminate	verb	Medieval Latin	return an accusation against someone or engage in mutual accusationsrecriminatory	adjective	Medieval Latin	countering one charge with anotherrectification	noun	Middle English	determination of the length of a curverectitude	noun	Middle English	righteousness as a consequence of being honorable and honestrecumbent	adjective	Latin	lying downrecuperate	verb	Latin	get over an illness or shockrecurrence	noun	Middle English	happening againrecusant	adjective	Latin	refusing to submit to authorityredaction	noun	French	the act of putting something in writingredundant	adjective	Latin	repetition of same sense in different wordsreevaluate	verb	Middle English	revise or renew one's assessmentreferendum	noun	New Latin	a legislative act is referred for final approval to a popular vote by the electoraterefulgent	adjective	Latin	radiating or as if radiating lightrefute	verb	Latin	prove to be false or incorrectregale	verb	French	provide with choice or abundant food or drinkreggae	noun	origin unknown	popular music originating in the West Indiesregicide	noun	Latin	the act of killing a kingregiment	noun	Middle English	army unit smaller than a divisionregurgitate	verb	Medieval Latin	repeat after memorizationrehabilitation	noun	Medieval Latin	the restoration of someone to a useful place in societyreify	verb	Latin	consider an abstract concept to be realreiterate	verb	Middle English	"to say, state, or perform again"relegate	verb	Latin	assign to a class or kindreligious	adjective	Middle English	having or showing belief in and reverence for a deityrelinquished	adjective	Middle English	given up often unwillinglyreliquary	noun	French	a container where religious relics are stored or displayedreluctantly	adverb	Latin	with reluctanceremand	noun	Middle English	the act of sending an accused person back into custody to await trialremora	noun	Late Latin	marine fishes with a flattened elongated body and a sucking disk on the head for attaching to large fish or moving objectsremuda	noun	American Spanish	the herd of horses from which those to be used the next day are chosenrenaissance	noun	French	the period of European history at the close of the Middle Ages and the rise of the modern worldrenascent	adjective	Latin	rising again as to new life and vigorrendezvous	noun	Middle French	a meeting planned at a certain time and placereniform	adjective	New Latin	of a leaf or bean shape resembling the shape of kidneyrenounce	verb	Middle English	cast off or disownrepartee	noun	French	adroitness and cleverness in replyrepechage	noun	French	a race in which runners-up in the eliminating heats compete for a place in the final racerepercussion	noun	Latin	a remote or indirect consequence of some actionrepertoire	noun	French	a collection of works that an artist or company can perform and do perform for short intervals on a regular schedulereplenish	verb	Middle English	fill something that had previously been emptiedreplete	adj.deeply	Middle English	filled or permeatedreprisal	noun	Middle English	a retaliatory action against an enemy in wartimereprobate	adjective	Middle English	marked by immoralityrequiem	noun	Middle English	a Mass celebrated for the deadRequiem	noun	Middle English	a Mass celebrated for the deadrequisite	adjective	Middle English	necessary for relief or supplyreredos	noun	Middle English	a painted or carved screen placed above and behind an altar or communion tablerescission	noun	Late Latin	the act of rescindingreseau	noun	French	a network of fine lines used by astronomers as a reference for measurements on star photographsreservoir	noun	French	tank used for collecting and storing a liquidresile	verb	Late Latin and Latin	return to the original position or state after being stretched or compressedresin	noun	Middle English	any of a class of solid or semisolid viscous substances obtained either as exudations from certain plants or prepared by polymerization of simple moleculesresurgent	adjective	Latin	rising again as to new life and vigorresuscitate	verb	Latin	cause to regain consciousnessreticle	noun	Latin	"a network of fine lines, dots, cross hairs, or wires in the focal plane of the eyepiece of an optical instrument"reticule	noun	French	a woman's drawstring handbagretina	noun	Middle English	the light-sensitive membrane covering the back wall of the eyeballretinue	noun	Middle English	the group following and attending to some important personretrorse	adjective	Latin	bent or curved backward or downwardrevenant	adjective	French	of or relating to or typical of a revenantrevenue	noun	Middle English	the entire amount of income before any deductions are maderevocable	adjective	Middle English	capable of being revoked or annulledrhabdomancer	noun	Late Greek	someone who uses a divining rod to find underground waterrhabdomancy	noun	Late Greek	searching for underground water or minerals by using a dowsing rodrhea	noun	New Latin	larger of two tall fast-running flightless birds similar to ostriches but three-toedrheological	adjective	International Scientific Vocabulary	of or relating to rheologyrhinencephalon	noun	New Latin	a center in the cerebral hemispheres that governs the sense of smell in lower animalsrhinitis	noun	New Latin	an inflammation of the mucous membrane lining the noserhinoceros	noun	Middle English	massive powerful herbivorous odd-toed ungulate of southeast Asia and Africa having very thick skin and one or two horns on the snoutrhizomatous	adjective	International Scientific Vocabulary	producing or possessing or resembling rhizomesrhodochrosite	noun	German	a mineral consisting of manganese carbonaterhododendron	noun	New Latin	any shrub of the genus Rhododendron: evergreen shrubs or small shrubby trees having leathery leaves and showy clusters of campanulate flowersrhodopsin	noun	International Scientific Vocabulary	a red photopigment in the retinal rods of vertebratesrhonchus	noun	Late Greek	a sound like whistling or snoring that is heard with a stethoscope during expiration as air passes through obstructed channelsrhubarb	noun	Middle English	plants having long green or reddish acidic leafstalks growing in basal clumpsrhumb	noun	Spanish	a line on a sphere that cuts all meridians at the same anglerhythm	noun	Middle French and Latin	recurring at regular intervalsriant	adjective	Middle French	showing or feeling mirth or pleasure or happinessribald	adjective	Middle English	humorously vulgarrickettsial	adjective	New Latin	relating to or caused by rickettsiasricochet	noun	French	a glancing reboundricotta	noun	Italian	soft Italian cheese like cottage cheeserictus	noun	New Latin	a gaping grimaceridiculously	adverb	Latin	so as to arouse or deserve laughterrigatoni	noun	Italian	tubular pasta in short ribbed piecesrime	noun	Middle English	correspondence in the sounds of two or more linesriparian	adjective	Latin	of or relating to or located on the banks of a river or streamrisible	adjective	Late Latin	arousing or provoking laughterrissole	noun	French	minced cooked meat or fish coated in egg and breadcrumbs and fried in deep fatritardando	adjective	Italian	gradually decreasing in temporococo	adjective	French	having excessive asymmetrical ornamentationrollick	verb	origin unknown	play boisterouslyromaine	noun	French	lettuce with long dark-green leaves in a loosely packed elongated headrondeau	noun	Middle French	a French verse form of 10 or 13 lines running on two rhymesrorqual	noun	French	any of several baleen whales of the family Balaenopteridae having longitudinal grooves on the throat and a small pointed dorsal finrosemaling	noun	Norwegian	a Scandinavian style of carved or painted decoration consisting of floral motifsroseola	noun	New Latin	any red eruption of the skinrotogravure	noun	German	printed material produced by an intaglio printing process in a rotary pressrottweiler	noun	German	German breed of large vigorous short-haired cattle dogsrouge	noun	French	makeup consisting of a pink or red powder applied to the cheeksroulade	noun	French	an elaborate run of several notes sung to one syllablerouleau	noun	French	a roll of coins wrapped in paperroulette	noun	French	a gambling game in which players bet on which compartment of a revolving wheel a small ball will come to rest inroundelay	noun	Middle English	a song in which a line or phrase is repeated as the refrainroux	noun	French	a mixture of fat and flour heated and used as a basis for saucesrowel	noun	Middle English	a small spiked wheel at the end of a spurrubato	noun	Italian	a flexible temporubefacient	noun	Latin	a medicine for external application that produces redness of the skinRubicon	noun	Latin	a line that when crossed permits of no return and typically results in irrevocable commitmentrubric	noun	Middle English	an authoritative ruleruminate	verb	Latin	chew the cudsrupicolous	adjective	Latin	composed of or inscribed on rockruse	noun	French	a deceptive maneuverrusset	adjective	Middle English	of brown with a reddish tingesabbatical	adjective	Late Latin	of or relating to sabbatical leavesabot	noun	French	a shoe carved from a single block of woodsabotage	noun	French	a deliberate act of destruction or disruption in which equipment is damagedsaboteur	noun	French	someone who commits sabotage or deliberately causes wreckssabra	noun	Modern Hebrew	a native-born Israelisaccade	noun	French	"a rapid, jerky movement of the eyes between positions of rest"saccadic	adjective	French	of or related to the rapid movement of the eyes between points of fixation